ПІБ кандидата,Партія,Номер територіального виборчого округу (в порядку зростання),Код статті,Дата платежу,Номер розрахункового документа,Отримувач (повна назва),Місцезнаходження отримувача,Код отримувача (ЄДРПОУ),Призначення платежу,Сума (грн),Тип бенефіціара,Розшифровка коду витрат
Купрій Віталій Миколайович,самовисування,217,1110,2019-01-23,1,ФОП Шовковська К. О.,м. Київ,,+;1110;виготовлення друко ваних матеріалів (плака тів) зг. з рах. № 00000000096 від 21.01.2019 р. без ПДВ.,"15801,5",ФОП,"виготовлення друкованих матеріалів (виборчих листівок, плакатів та інших агітаційних матеріалів чи видань)"
Купрій Віталій Миколайович,самовисування,217,1350,2019-02-01,121,ПП “Індивідуал”,м. Київ,33696193,"+;1350;розміщення політичної реклами на носіях зовнішньої рекла ми згідно з рахун ком № 48 від 31 січня 2019 року, у тому числі ПДВ 20%",14000,юридична особа,"розміщення друкованих агітаційних матеріалів чи політичної реклами на носіях зовнішньої реклами (білбордах, вивісках, сітілайтах тощо)"
Купрій Віталій Миколайович,самовисування,217,1110,2019-02-08,123,ТОВ “Прес корпорейшн лімітед”,м. Вінниця,32168763,+;1110;Виготовлення полігра фічної продукції згідно з рахунком № СФ-0000447 від 4 лютого 2019 р.,20000,юридична особа,"виготовлення друкованих матеріалів (виборчих листівок, плакатів та інших агітаційних матеріалів чи видань)"
Купрій Віталій Миколайович,самовисування,217,1110,2019-02-11,125,ТОВ “Прес корпорейшн лімітед”,м. Вінниця,32168763,+;1110;виготовлення полігра фічноїпродукції згідно з рахунком № СФ-0000447 від 4.02.2019 ,38328,юридична особа,"виготовлення друкованих матеріалів (виборчих листівок, плакатів та інших агітаційних матеріалів чи видань)"
Купрій Віталій Миколайович,самовисування,217,1110,2019-02-13,127,ТОВ “Прес корпорейшн лімітед”,м. Вінниця,32168763,"+;1110;Виготовлення полігра фічної продукції згідно з рахунком № СФ-0000560 від 12.02.2019 р., т.ч. ПДВ 20%  ",57870,юридична особа,"виготовлення друкованих матеріалів (виборчих листівок, плакатів та інших агітаційних матеріалів чи видань)"
Купрій Віталій Миколайович,самовисування,217,1110,2019-02-22,129,ФОП Залеський О.М.,м. Дніпро,,"+;1110;Виготовлення друкова них мате ріалів зг. з рах. №29 від 21 лютого 2019 р., без ПДВ",5300,ФОП,"виготовлення друкованих матеріалів (виборчих листівок, плакатів та інших агітаційних матеріалів чи видань)"
Купрій Віталій Миколайович,самовисування,217,1340,2019-02-27,22545171,Підприємство “Будинок профспілок” Дніпропетровського обласного об’єднання профспілок,м. Дніпро,23941567,"+;1340;оренда зали згідно рахунку № 610 від 20 лютого 2019 року, у тому числі ПДВ 20%",4000,юридична особа,оренда будинків і приміщень усіх форм власності для проведення зборів громадян та інших зустрічей з виборцями
