ПІБ кандидата,Партія,Номер територіального виборчого округу (в порядку зростання),Код статті,Дата платежу,Номер розрахункового документа,Отримувач (повна назва),Місцезнаходження отримувача,Код отримувача (ЄДРПОУ),Призначення платежу,Сума (грн),Тип бенефіціара,Розшифровка коду витрат
Тимошенко Юрій Володимирович,самовисування,221,1110,2019-03-18,22794283,"ТОВ ""АВС коммунікейшн""","м. Київ, вул. Каштанова, буд. 13, кв. 172",41481696,"+;1110; оплата за листівки А4 згідно Рахунку №7 від 14.03.2019р. в т.ч. ПДВ 6463,33 грн. платник кандидат на пост Президента Укр. Тимошенко Ю.В.",38780,юридична особа,"виготовлення друкованих матеріалів (виборчих листівок, плакатів та інших агітаційних матеріалів чи видань)"
Тимошенко Юрій Володимирович,самовисування,221,2100,2019-03-28,J0328XU05A,Козмич М.М.,,,Повернення фізичним особам добровільних внесків,2670,фізична особа,Повернення особам добровільних внесків
Тимошенко Юрій Володимирович,самовисування,221,2100,2019-03-29,22986985,Неміш Василь Іванович,,,Повернення фізичним особам добровільних внесків,5000,фізична особа,Повернення особам добровільних внесків
Тимошенко Юрій Володимирович,самовисування,221,3210,2019-03-19,22774513,Гавінський Іван Орестович ,"м. Бібрка, вул. Кравченка, буд. 11, кв. 41",,Перерахування внесків фізичних осіб до Державного бюджету України,100,фізична особа,Перерахування внесків фізичних осіб до Державного бюджету
Тимошенко Юрій Володимирович,самовисування,221,1110,2019-03-28,22961984,"ТОВ ""АВС коммунікейшн""","м. Київ, вул. Каштанова, буд. 13, кв. 172",41481696,"+;1110; оплата за листівки А4 згідно Рахунку №11 від 28.03.2019р. платник кандидат на посаду Президента Укр. Тимошенко Ю.В з  ПДВ 5036,67 грн.",30220,юридична особа,"виготовлення друкованих матеріалів (виборчих листівок, плакатів та інших агітаційних матеріалів чи видань)"
