ПІБ кандидата,Партія,Номер територіального виборчого округу (в порядку зростання),Код статті,Дата платежу,Номер розрахункового документа,Отримувач (повна назва),Місцезнаходження отримувача,Код отримувача (ЄДРПОУ),Призначення платежу,Сума (грн),Тип бенефіціара,Розшифровка коду витрат
Балашов Геннадій Вікторович,5.10,221,1350,2019-03-04,3,ФОП Сіроштан Інна Олександрівна,м. Полтава,,"Розміщення політичної реклами на носіях зовнішньої реклами згідно з Договором № 280219 від 28.02.19,  (без ПДВ",2700,ФОП,"розміщення друкованих агітаційних матеріалів чи політичної реклами на носіях зовнішньої реклами (білбордах, вивісках, сітілайтах тощо)"
Балашов Геннадій Вікторович,5.10,221,1350,2019-03-04,1,ТОВ “Бізнес комунікації”,"Черкаська обл., м. Умань, вул. Ленінської Іскри, буд. 29, оф. 7",37715764,"Розміщення політичної реклами на носіях зовнішньої реклами згідно з Договором № 15 від 26.02.19,  (без ПДВ)",2720,юридична особа,"розміщення друкованих агітаційних матеріалів чи політичної реклами на носіях зовнішньої реклами (білбордах, вивісках, сітілайтах тощо)"
Балашов Геннадій Вікторович,5.10,221,1110,2019-03-04,2,ФОП Мироненко Сергій Віталійович,"Полтавська обл., Полтавський р-н, с. Нижні Млини",,"Виготовлення друкованих матеріалів згідно з Договором № 0103 від 01.03.19,  в т.ч. ПДВ 20%.",8412,ФОП,"транспортні послуги для реалізації заходів передвиборної агітації (перевезення матеріалів передвиборної агітації, технічних засобів та обладнання для ведення передвиборної агітації, а також інших матеріалів, пов’язаних з передвиборною агітацією)"
Балашов Геннадій Вікторович,5.10,221,1350,2019-03-20,22847546,ФОП Сіроштан Інна Олександрівна,"м. Полтава, вул. Кучеренка, буд. 9, корп. 3, кв. 33",,"Розміщення політичної реклами на носіях зовнішньої реклами згідно з Договором № 280219 від 28.02.19, Рахунок 62 (без ПДВ)","2700,00",ФОП,"розміщення друкованих агітаційних матеріалів чи політичної реклами на носіях зовнішньої реклами (білбордах, вивісках, сітілайтах тощо)"
Балашов Геннадій Вікторович,5.10,221,1350,2019-03-20,22847637,ФОП Сіроштан Інна Олександрівна,"м. Полтава, вул. Кучеренка, буд. 9, корп. 3, кв. 33",,"Розміщення політичної реклами на носіях зовнішньої реклами згідно з Договором № 280219 від 28.02.19, Рахунок 63 (без ПДВ)","2700,00",ФОП,"розміщення друкованих агітаційних матеріалів чи політичної реклами на носіях зовнішньої реклами (білбордах, вивісках, сітілайтах тощо)"
Балашов Геннадій Вікторович,5.10,221,1150,2019-03-27,22945047,ФОП Сидоров Микола Сергійович,"м. Київ, вул. Стеценка, буд. 3, кв. 35",,"Придбання канцтоварів, паперу згідно з Рахунком – фактурою № 136 від 26.03.2019 р.,  (без ПДВ).","1040,00",ФОП,"придбання канцтоварів, паперу, інших предметів і матеріалів для виготовлення матеріалів передвиборної агітації"
