ПІБ кандидата,Партія,Номер територіального виборчого округу (в порядку зростання),Код статті,Дата платежу,Номер розрахункового документа,Отримувач (повна назва),Місцезнаходження отримувача,Код отримувача (ЄДРПОУ),Призначення платежу,Сума (грн),Тип бенефіціара,Розшифровка коду витрат
Кармазін Юрій Анатолійович,Партія захисників Вітчизни,221,1211,2019-03-12,22717004,ВМП “Горизонт”,"Харківська обл., м. Первомайськ, вул. Гагаріна, буд. 16",21235948,+; оплата ефірного часу на телебаченні згідно рахунку№7 від 2019-03-12,28800,юридична особа,оплата ефірного часу на телебаченні
Кармазін Юрій Анатолійович,Партія захисників Вітчизни,221,1211,2019-03-13,22740497,ТОВ “Наша Прага”,"м. Київ, вул. Жилянська, буд. 101А",33642085,+; оплата ефірного часу на телебаченні згідно рахунку№11 від 2019-03-13,175200,юридична особа,оплата ефірного часу на телебаченні
Кармазін Юрій Анатолійович,Партія захисників Вітчизни,221,1211,2019-03-13,22739533,ТОВ “Коледж преси та телебачення”,"м. Миколаїв, вул. Даля, буд. 11А",20914191,+; оплата ефірного часу на телебаченні згідно рахунку№1-юк від 2019-03-13,40000,юридична особа,оплата ефірного часу на телебаченні
Кармазін Юрій Анатолійович,Партія захисників Вітчизни,221,1211,2019-03-14,22757340,ТОВ “Телекомпанія “Телесвіт”,"м. Київ, вул. Сімʼї Хохлових, буд. 15, оф. 508",35210849,+;оплата ефірного часу на телебаченні згідно рахунку№5 від 2019-03-14,23200,юридична особа,оплата ефірного часу на телебаченні
Кармазін Юрій Анатолійович,Партія захисників Вітчизни,221,1211,2019-03-15,22765380,ТОВ “Телерадіокомпанія “Відікон”,"м. Суми, вул. Харківська, буд. 5",21107661,+; оплата ефірного часу на телебаченні згідно рахунку№72 від 2019-03-14,18720,юридична особа,оплата ефірного часу на телебаченні
Кармазін Юрій Анатолійович,Партія захисників Вітчизни,221,1211,2019-03-15,22779234,ТОВ “ТРК 3-Студія”,"м. Івано-Франківськ, вул. Січових Стрільців, буд. 56",23797886,+; оплата ефірного часу на телебаченні згідно рахунку№С Ф0000027 від 2019-03-14,28080,юридична особа,оплата ефірного часу на телебаченні
Кармазін Юрій Анатолійович,Партія захисників Вітчизни,221,1211,2019-03-15,22776821,"ТОВ ""Телерадіокомпанія ТТV""","м. Кропивницький, вул. Медведєва, буд. 1А",13745760,+; оплата ефірного часу на телебаченні згідно рахунку№36 від 2019-03-14,23400,юридична особа,оплата ефірного часу на телебаченні
Кармазін Юрій Анатолійович,Партія захисників Вітчизни,221,1211,2019-03-18,22799828,"ТОВ ""Телерадіокомпанія ""Вікка""","м. Черкаси, вул. Юрія Іллєнка, буд. 27",21385292,+; оплата ефірного часу на телебаченні згідно рахунку№68- Івід 2019-03-14,"12991,68",юридична особа,оплата ефірного часу на телебаченні
Кармазін Юрій Анатолійович,Партія захисників Вітчизни,221,1211,2019-03-18,22798496,"ТОВ ""Телерадіокомпанія ""Вікка""","м. Черкаси, вул. Юрія Іллєнка, буд. 27",21385292,+; оплата ефірного часу на телебаченні згідно рахунку№С Ф000553від 2019-03-18,18330,юридична особа,оплата ефірного часу на телебаченні
Кармазін Юрій Анатолійович,Партія захисників Вітчизни,221,1211,2019-03-19,22824585,"ПАТ ""НСТУ""","м. Київ, вул. Мельникова, буд. 42",23152907,оплата ефірного часу на телебаченні згідно рахунку№НТК000000296 від2019-03-19,"15993,12",юридична особа,оплата ефірного часу на телебаченні
Кармазін Юрій Анатолійович,Партія захисників Вітчизни,221,1211,2019-03-19,22826025,ПП “Телерадіокомпанія “Сфера-ТВ”,"м. Рівне, вул. Міцкевича, буд. 11, оф. 30",33910609,оплата ефірного часу на телебаченні згідно рахунку№13/п/1 від 19.03.19,25080,юридична особа,оплата ефірного часу на телебаченні
Кармазін Юрій Анатолійович,Партія захисників Вітчизни,221,1211,2019-03-19,22826944,"ВМП ""Горизонт""","Харківська обл., м. Первомайськ, вул. Гагаріна, буд. 16",21235948,оплата ефірного часу на телебаченні згідно рахунку№27 від 2019-03-18,28800,юридична особа,оплата ефірного часу на телебаченні
Кармазін Юрій Анатолійович,Партія захисників Вітчизни,221,1211,2019-03-19,22812264,"ПАТ ""НСТУ""","м. Київ, вул. Мельникова, буд. 42",23152907,оплата ефірного часу на телебаченні згідно рахунку№НТК000000288 від 2019-03-18,"47235,76",юридична особа,оплата ефірного часу на телебаченні
Кармазін Юрій Анатолійович,Партія захисників Вітчизни,221,1110,2019-03-20,22843684,ФОП Дітрих Маргарита Вікторівна,м. Київ,,оплата за виготовлення друкованих матеріалів №МВ-0000046 від 2019-03-20р,2570,ФОП,"виготовлення друкованих матеріалів (виборчих листівок, плакатів та інших агітаційних матеріалів чи видань)"
Кармазін Юрій Анатолійович,Партія захисників Вітчизни,221,1110,2019-03-20,22847227,ФОП Дітрих Маргарита Вікторівна,м. Київ,,оплата за виготовлення друкованих матеріалів №МВ-0000047 від 2019-03-20р,9850,ФОП,"виготовлення друкованих матеріалів (виборчих листівок, плакатів та інших агітаційних матеріалів чи видань)"
Кармазін Юрій Анатолійович,Партія захисників Вітчизни,221,1211,2019-03-21,22854976,"МКП Інформаційно-телевізійне агентство ""ВІТА""","м. Вінниця, вул. Соборна, буд. 59",13341352,оплата ефірного часу на телебаченні згідно рахунку№41 від 2019-03-20,2160,юридична особа,оплата ефірного часу на телебаченні
Кармазін Юрій Анатолійович,Партія захисників Вітчизни,221,1211,2019-03-21,22854825,"МКП Інформаційно-телевізійне агентство ""ВІТА""","м. Вінниця, вул. Соборна, буд. 59",13341352,оплата ефірного часу на телебаченні згідно рахунку№40 від 2019-03-20,6400,юридична особа,оплата ефірного часу на телебаченні
Кармазін Юрій Анатолійович,Партія захисників Вітчизни,221,1211,2019-03-21,22867022,"ПП ""Телерадіоорганізація ""Тернопіль-Медіа""","м. Тернопіль, вул. Олени Кульчицької, буд. 2А",41302104,оплата ефірного часу на телебаченні згідно рахунку№СФ-0000048 від 2019-03-21,22500,юридична особа,оплата ефірного часу на телебаченні
Кармазін Юрій Анатолійович,Партія захисників Вітчизни,221,1211,2019-03-21,22866934,"Обласна асоціація ""Вінницька громадська телерадіокомпанія ""Вінниччина""","м. Вінниця, вул. Театральна, буд. 15",31473359,оплата ефірного часу на телебаченні згідно рахунку№СФ-0000078 2019-03-21,6480,юридична особа,оплата ефірного часу на телебаченні
Кармазін Юрій Анатолійович,Партія захисників Вітчизни,221,1211,2019-03-22,22882777,"Обласна асоціація ""Вінницька громадська телерадіокомпанія ""Вінниччина""","м. Вінниця, вул. Театральна, буд. 15",31473359,оплата ефірного часу на телебаченні згідно рахунку№СФ-0000084 2019-03-22,6480,юридична особа,оплата ефірного часу на телебаченні
Кармазін Юрій Анатолійович,Партія захисників Вітчизни,221,1211,2019-03-22,22884503,"ДП ""Дитяче телевізійне агентство""","м. Хмельницький, буд. 21Б",23843362,оплата ефірного часу на телебаченні згідно рахунку№54 2019-03-22,37500,юридична особа,оплата ефірного часу на телебаченні
Кармазін Юрій Анатолійович,Партія захисників Вітчизни,221,1211,2019-03-25,22901409,"ТОВ ""Медіа-Проспект""","м. Житомир, вул. Велика Бердичівська, буд. 72",38500053,оплата ефірного часу на телебаченні згідно рахунку№81 2019-03-25,12000,юридична особа,оплата ефірного часу на телебаченні
Кармазін Юрій Анатолійович,Партія захисників Вітчизни,221,1211,2019-03-26,22910266,"ТОВ ""Телерадіокомпанія Рівне 1""","м. Рівне, вул. Данила Галицького, буд. 19, оф. 701",22573340,оплата ефірного часу на телебаченні згідно рахунку№СФ0000020 2019-03-24,21600,юридична особа,оплата ефірного часу на телебаченні
Кармазін Юрій Анатолійович,Партія захисників Вітчизни,221,1220,2019-03-26,22922346,"ТОВ ""Редакція газети""Прибузька зоря""""","м. Хмельницький, вул. Камʼянецька, буд. 122/2",02475718,оплата друкованих площ у друкованих засобах масової інформації згідно рахунку№562019-03-25,2400,юридична особа,оплата друкованих площ у друкованих засобах масової інформації
Кармазін Юрій Анатолійович,Партія захисників Вітчизни,221,1212,2019-03-26,22911964,"ТОВ ""Радіо Трек""","м. Рівне, вул. Кавказька, буд. 2",23302560,оплата ефірного часу на радіо згідно рахунку №3702 від 2019-03-22,10000,юридична особа,оплата ефірного часу на радіо
Кармазін Юрій Анатолійович,Партія захисників Вітчизни,221,1340,2019-03-26,22922588,Хмельницька торгово-промислова палата,"м. Хмельницький, вул. Подільська, буд. 109/1",02944774,оренда будинків і приміщень усіх форм власності для проведення зборів громадян та інших зустрічей з виборцями згідно рахунку №732 від 2019-03-23,450,юридична особа,оренда будинків і приміщень усіх форм власності для проведення зборів громадян та інших зустрічей з виборцями
Кармазін Юрій Анатолійович,Партія захисників Вітчизни,221,1220,2019-03-26,22922900,"ТОВ ""Газета Проскурів""","м. Хмельницький, вул. Прибузька, буд. 2",14175341,оплата друкованих площ у друкованих засобах масової інформації згідно рахунку№292019-03-25,2500,юридична особа,оплата друкованих площ у друкованих засобах масової інформації
Кармазін Юрій Анатолійович,Партія захисників Вітчизни,221,1211,2019-03-27,22944563,"ТОВ ""Інформаційний телеканал ""Репортер""","м. Одеса, вул. Зоопаркова, буд. 25",22448563,оплата ефірного часу на телебаченні згідно рахунку№642019-03-26,21600,юридична особа,оплата ефірного часу на телебаченні
Кармазін Юрій Анатолійович,Партія захисників Вітчизни,221,1211,2019-03-27,22956795,"ТОВ “Бізнес центр ""Звенигора""","Черкаська обл., Звенигородський р-н, м. Звенигородка, вул. Енгельса, буд. 142",37699355,оплата ефірного часу на телебаченні згідно рахунку№2901/031 від 2019-03-26,360,юридична особа,оплата ефірного часу на телебаченні
Кармазін Юрій Анатолійович,Партія захисників Вітчизни,221,1211,2019-03-27,22922756,"Міське КП ""Муніципальна телерадіокомпанія ""Місто""","м. Хмельницький, вул. Проскурівська, буд. 4/3",32402179,оплата ефірного часу на телебаченні згідно рахунку№1 від 2019-03-22,6500,юридична особа,оплата ефірного часу на телебаченні
Кармазін Юрій Анатолійович,Партія захисників Вітчизни,221,1211,2019-03-28,22970562,"ВМП ""Горизонт""","Харківська обл., м. Первомайськ, вул. Гагаріна, буд. 16",21235948,оплата ефірного часу на телебаченні згідно рахунку№28 від 2019-03-28,2800,юридична особа,оплата ефірного часу на телебаченні
